{
  "receipt_id": "01940000-0000-7000-8000-0000000000b1",
  "kind": "accepted",
  "mandate_id": "01940000-0000-7000-8000-0000000000a1",
  "mandate_envelope_hash": "09697a9332db66f67db433e02e55617b92db2d2d0dfe1eda303916bae105260c",
  "mandate_anchor": { "topic": "0.0.1234567", "seq": 1, "consensus_ts": "1768813570.000000001" },
  "taken": [
    "The user sees the list of notification channels, each with its own toggle",
    "A changed toggle is saved and survives a page reload"
  ],
  "declined": [],
  "issued_at": "2026-01-19T09:06:10Z",
  "issuer": "agency-a"
}
